{
  "$schema": "http://json-schema.org/draft-07/schema#",
  "$id": "https://raw.githubusercontent.com/ai-plugin-marketplace-template/main/schemas/marketplace.json",
  "title": "AI Plugin Marketplace",
  "description": "Marketplace registry listing available plugins",
  "type": "object",
  "required": ["name", "owner", "plugins"],
  "properties": {
    "name": {
      "type": "string",
      "pattern": "^[a-z][a-z0-9-]*$",
      "description": "Marketplace name (lowercase, hyphens, no spaces)"
    },
    "owner": {
      "type": "object",
      "required": ["name"],
      "properties": {
        "name": { "type": "string" },
        "email": { "type": "string", "format": "email" },
        "url": { "type": "string", "format": "uri" }
      },
      "additionalProperties": false,
      "description": "Marketplace owner information"
    },
    "metadata": {
      "type": "object",
      "properties": {
        "pluginRoot": { "type": "string" },
        "version": { "type": "string" },
        "description": { "type": "string" }
      },
      "additionalProperties": false,
      "description": "Optional metadata about the marketplace"
    },
    "plugins": {
      "type": "array",
      "items": {
        "type": "object",
        "required": ["name", "source"],
        "properties": {
          "name": {
            "type": "string",
            "description": "Plugin name (must match plugin manifest name)"
          },
          "source": {
            "oneOf": [
              {
                "type": "string",
                "pattern": "^\\./",
                "description": "Relative path to plugin directory (must start with ./)"
              },
              {
                "type": "object",
                "description": "GitHub, npm, or other source specification"
              }
            ],
            "description": "Plugin source — relative path or source specification object"
          },
          "description": {
            "type": "string",
            "description": "Plugin description"
          },
          "category": {
            "type": "string",
            "description": "Plugin category"
          },
          "tags": {
            "type": "array",
            "items": { "type": "string" },
            "description": "Discovery tags (use 'tags', not 'keywords')"
          },
          "strict": {
            "type": "boolean",
            "description": "Whether to apply strict validation (default: true)"
          }
        },
        "additionalProperties": false
      },
      "description": "List of plugins in this marketplace"
    },
    "forceRemoveDeletedPlugins": {
      "type": "boolean",
      "description": "Whether to remove plugins that no longer appear in the manifest"
    }
  },
  "additionalProperties": false
}
