{
  "name": "ai-plugin-marketplace",
  "owner": {
    "name": "AI Plugin Marketplace Template"
  },
  "metadata": {
    "version": "0.0.1",
    "description": "Universal AI Plugin Marketplace — author once, distribute to all platforms"
  },
  "plugins": [
    {
      "name": "skill-evaluator",
      "source": "./plugins/skill-evaluator",
      "description": "Evaluate AI skills across model tiers with blind testing and refinement recommendations",
      "tags": ["evaluation", "testing", "skills", "model-tiers"]
    }
  ]
}
